{
  "schema": "ttrpg-spell/0.1",
  "id": "pf2e:logm:adapt-self",
  "name": "Adapt Self",
  "gameSystem": "pf2e",
  "variant": "logm",
  "source": {
    "code": "logm",
    "name": "LOGM p.112",
    "page": 112,
    "path": "spells/pf2e/logm/adapt-self.md"
  },
  "level": {
    "kind": "focus",
    "value": 1,
    "display": "Focus 1"
  },
  "identity": {
    "rarity": "common",
    "traits": [
      "morph",
      "transmutation"
    ],
    "school": null,
    "traditions": [],
    "classes": [],
    "cantrip": false,
    "ritual": false
  },
  "activity": {
    "unit": "action",
    "number": 2,
    "symbol": "◆◆"
  },
  "trigger": null,
  "components": {
    "list": [
      "somatic",
      "verbal"
    ],
    "material": null,
    "cost": null,
    "currency": null,
    "consumed": null
  },
  "range": null,
  "targets": null,
  "area": null,
  "duration": {
    "text": "1 minute",
    "value": 1,
    "unit": "minute",
    "concentration": false,
    "sustained": false
  },
  "save": null,
  "attack": null,
  "damage": [],
  "heightening": [],
  "entries": [
    "You make subtle changes to yourself to adapt to the situation.",
    "Choose one of the following options that applies to you."
  ],
  "systemExtras": {
    "fields": [
      "Cast",
      "Duration",
      "Level",
      "Source"
    ]
  },
  "parse": {
    "status": "ok",
    "warnings": [],
    "unmapped": []
  }
}