{
  "schema": "ttrpg-spell/0.1",
  "id": "pf2e:hotw:summon-stampede",
  "name": "Summon Stampede",
  "gameSystem": "pf2e",
  "variant": "hotw",
  "source": {
    "code": "hotw",
    "name": "HotW p.87",
    "page": 87,
    "path": "spells/pf2e/hotw/summon-stampede.md"
  },
  "level": {
    "kind": "rank",
    "value": 7,
    "display": "Spell 7"
  },
  "identity": {
    "rarity": "common",
    "traits": [
      "concentrate",
      "incarnate",
      "manipulate"
    ],
    "school": null,
    "traditions": [
      "primal"
    ],
    "classes": [],
    "cantrip": false,
    "ritual": false
  },
  "activity": {
    "unit": "action",
    "number": 3,
    "symbol": "◆◆◆"
  },
  "trigger": null,
  "components": {
    "list": [],
    "material": null,
    "cost": null,
    "currency": null,
    "consumed": null
  },
  "range": {
    "text": "120 feet",
    "value": 120,
    "unit": "ft"
  },
  "targets": null,
  "area": null,
  "duration": {
    "text": "until the end of your next turn",
    "value": null,
    "unit": null,
    "concentration": false,
    "sustained": false
  },
  "save": {
    "defense": "reflex or will",
    "dc": null,
    "basic": true,
    "outcomes": {
      "criticalSuccess": "none",
      "success": "half",
      "failure": "full",
      "criticalFailure": "double"
    }
  },
  "attack": null,
  "damage": [],
  "heightening": [],
  "entries": [
    "You summon an unstoppable stampede of panicking beasts. Whether you conjure wild beasts or tamed cattle, the stampede is a force of nature that leaves behind nothing in its wake. The stampede occupies the space of a Gargantuan creature and has a Speed of 60 feet."
  ],
  "systemExtras": {
    "fields": [
      "Cast",
      "Duration",
      "Level",
      "Range",
      "Saving Throw",
      "Source",
      "Traditions"
    ]
  },
  "parse": {
    "status": "ok",
    "warnings": [],
    "unmapped": []
  }
}