{
  "schema": "ttrpg-spell/0.1",
  "id": "pf2e:loil:steal-the-sky",
  "name": "Steal the Sky",
  "gameSystem": "pf2e",
  "variant": "loil",
  "source": {
    "code": "loil",
    "name": "LOIL p.225",
    "page": 225,
    "path": "spells/pf2e/loil/steal-the-sky.md"
  },
  "level": {
    "kind": "focus",
    "value": 5,
    "display": "Focus 5"
  },
  "identity": {
    "rarity": "uncommon",
    "traits": [
      "uncommon",
      "air",
      "evocation"
    ],
    "school": null,
    "traditions": [],
    "classes": [],
    "cantrip": false,
    "ritual": false
  },
  "activity": {
    "unit": "reaction",
    "number": 1,
    "symbol": "◈"
  },
  "trigger": null,
  "components": {
    "list": [],
    "material": null,
    "cost": null,
    "currency": null,
    "consumed": null
  },
  "range": null,
  "targets": "the creature you hit",
  "area": null,
  "duration": null,
  "save": {
    "defense": "fortitude",
    "dc": null,
    "basic": false,
    "outcomes": {}
  },
  "attack": null,
  "damage": [],
  "heightening": [
    {
      "kind": "increment",
      "step": 1,
      "atRank": null,
      "text": "Increase the distance the creature must descend by 20 feet."
    }
  ],
  "entries": [
    "You deny a flying creature the support of the air."
  ],
  "systemExtras": {
    "fields": [
      "Cast",
      "Level",
      "Saving Throw",
      "Source",
      "Targets"
    ]
  },
  "parse": {
    "status": "partial",
    "warnings": [
      "degree-of-success labels present but empty in source"
    ],
    "unmapped": []
  }
}