{
  "schema": "ttrpg-spell/0.1",
  "id": "pf2e:woi:it-is-written",
  "name": "It Is Written",
  "gameSystem": "pf2e",
  "variant": "woi",
  "source": {
    "code": "woi",
    "name": "WoI p.156",
    "page": 156,
    "path": "spells/pf2e/woi/it-is-written.md"
  },
  "level": {
    "kind": "rank",
    "value": 4,
    "display": "Spell 4"
  },
  "identity": {
    "rarity": "rare",
    "traits": [
      "rare",
      "concentrate",
      "mythic",
      "prediction"
    ],
    "school": null,
    "traditions": [
      "arcane",
      "divine",
      "occult"
    ],
    "classes": [],
    "cantrip": false,
    "ritual": false
  },
  "activity": {
    "unit": "action",
    "number": 1,
    "symbol": "◆"
  },
  "trigger": null,
  "components": {
    "list": [],
    "material": null,
    "cost": null,
    "currency": null,
    "consumed": null
  },
  "range": null,
  "targets": null,
  "area": null,
  "duration": {
    "text": "until the end of your next turn",
    "value": null,
    "unit": null,
    "concentration": false,
    "sustained": false
  },
  "save": null,
  "attack": null,
  "damage": [],
  "heightening": [],
  "entries": [
    "You envision a future for yourself, confident in the certainty that this vision is your destiny. Before the duration ends, if you would attempt an attack roll, Perception check, saving throw, or skill check that would aid in the fulfillment of this destiny, you can attempt this roll at mythic proficiency. You choose which roll to use this benefit on before rolling. If you use this benefit, the spell ends. Either way, you're then temporarily immune to it is written for 1 hour."
  ],
  "systemExtras": {
    "fields": [
      "Cast",
      "Duration",
      "Level",
      "Source",
      "Traditions"
    ]
  },
  "parse": {
    "status": "ok",
    "warnings": [],
    "unmapped": []
  }
}