{
  "schema": "ttrpg-spell/0.1",
  "id": "dnd5e:srd51:antimagic-field",
  "name": "Antimagic Field",
  "gameSystem": "dnd5e",
  "variant": "srd51",
  "source": {
    "code": "5.1_srd",
    "name": "5.1 SRD (D&D 2014)",
    "page": null,
    "path": "spells/5e/5.1_srd/antimagic-field.md"
  },
  "level": {
    "kind": "level",
    "value": 8,
    "display": "8"
  },
  "identity": {
    "rarity": null,
    "traits": [],
    "school": "Abjuration",
    "traditions": [],
    "classes": [
      "Cleric",
      "Wizard"
    ],
    "cantrip": false,
    "ritual": false
  },
  "activity": {
    "unit": "action",
    "number": 1,
    "symbol": null
  },
  "trigger": null,
  "components": {
    "list": [
      "verbal",
      "somatic",
      "material"
    ],
    "material": "A pinch of powdered iron or iron filings.",
    "cost": null,
    "currency": null,
    "consumed": false
  },
  "range": {
    "text": "Self",
    "value": null,
    "unit": null
  },
  "targets": null,
  "area": {
    "shape": "sphere",
    "size": 10,
    "unit": "ft",
    "text": "10-foot-radius"
  },
  "duration": {
    "text": "Concentration, up to 1 hour",
    "value": 1,
    "unit": "hour",
    "concentration": true,
    "sustained": false
  },
  "save": null,
  "attack": null,
  "damage": [],
  "heightening": [],
  "entries": [
    "A 10-foot-radius invisible sphere of antimagic surrounds you. This area is divorced from the magical energy that suffuses the multiverse. Within the sphere, spells can't be cast, summoned creatures disappear, and even magic items become mundane. Until the spell ends, the sphere moves with you, centered on you. Spells and other magical effects, except those created by an artifact or a deity, are suppressed in the sphere and can't protrude into it. A slot expended to cast a suppressed spell is consumed. While an effect is suppressed, it doesn't function, but the time it spends suppressed counts against its duration.",
    "**Targeted Effects.** Spells and other magical effects, such as magic missile and charm person, that target a creature or an object in the sphere have no effect on that target.",
    "**Areas of Magic.** The area of another spell or magical effect, such as fireball, can't extend into the sphere. If the sphere overlaps an area of magic, the part of the area that is covered by the sphere is suppressed. For example, the flames created by a wall of fire are suppressed within the sphere, creating a gap in the wall if the overlap is large enough.",
    "**Spells.** Any active spell or other magical effect on a creature or an object in the sphere is suppressed while the creature or object is in it.",
    "**Magic Items.** The properties and powers of magic items are suppressed in the sphere. For example, a +1 longsword in the sphere functions as a nonmagical longsword. A magic weapon's properties and powers are suppressed if it is used against a target in the sphere or wielded by an attacker in the sphere. If a magic weapon or a piece of magic ammunition fully leaves the sphere (for example, if you fire a magic arrow or throw a magic spear at a target outside the sphere), the magic of the item ceases to be suppressed as soon as it exits.",
    "**Magical Travel.** Teleportation and planar travel fail to work in the sphere, whether the sphere is the destination or the departure point for such magical travel. A portal to another location, world, or plane of existence, as well as an opening to an extradimensional space such as that created by the rope trick spell, temporarily closes while in the sphere.",
    "**Creatures and Objects.** A creature or object summoned or created by magic temporarily winks out of existence in the sphere. Such a creature instantly reappears once the space the creature occupied is no longer within the sphere.",
    "**Dispel Magic.** Spells and magical effects such as dispel magic have no effect on the sphere. Likewise, the spheres created by different antimagic field spells don't nullify each other."
  ],
  "systemExtras": {
    "fields": [
      "Casting Time",
      "Classes",
      "Components",
      "Duration",
      "Level",
      "Range",
      "Source"
    ]
  },
  "parse": {
    "status": "ok",
    "warnings": [],
    "unmapped": []
  }
}