{
  "schema": "ttrpg-spell/0.1",
  "id": "dnd5e:deepmagic:outflanking-boon",
  "name": "Outflanking Boon",
  "gameSystem": "dnd5e",
  "variant": "deepmagic",
  "source": {
    "code": "deep_magic",
    "name": "Deep Magic 5e",
    "page": null,
    "path": "spells/5e/deep_magic/outflanking-boon.md"
  },
  "level": {
    "kind": "level",
    "value": 3,
    "display": "3"
  },
  "identity": {
    "rarity": null,
    "traits": [],
    "school": "Illusion",
    "traditions": [],
    "classes": [
      "Bard",
      "Sorcerer",
      "Warlock",
      "Wizard"
    ],
    "cantrip": false,
    "ritual": false
  },
  "activity": {
    "unit": "action",
    "number": 1,
    "symbol": null
  },
  "trigger": null,
  "components": {
    "list": [
      "verbal",
      "somatic"
    ],
    "material": null,
    "cost": null,
    "currency": null,
    "consumed": null
  },
  "range": {
    "text": "30 feet",
    "value": 30,
    "unit": "ft"
  },
  "targets": null,
  "area": null,
  "duration": {
    "text": "Concentration, up to 1 minute",
    "value": 1,
    "unit": "minute",
    "concentration": true,
    "sustained": false
  },
  "save": {
    "defense": "wis",
    "dc": null,
    "basic": false,
    "outcomes": {
      "success": "none",
      "failure": "full"
    }
  },
  "attack": null,
  "damage": [],
  "heightening": [
    {
      "kind": "slot",
      "step": null,
      "atRank": null,
      "text": "When you cast this spell using a spell slot of 4th level or higher, the spell targets one additional enemy for each slot level above 3rd."
    }
  ],
  "entries": [
    "This spell targets one enemy, which must make a Wisdom saving throw. On a failed save, an illusory ally of yours appears in a space from which it threatens to make a melee attack against the target. Your allies gain advantage on melee attacks against the target for the duration because of the distracting effect of the illusion. An affected target repeats the saving throw at the end of each of its turns, ending the effect on itself on a success."
  ],
  "systemExtras": {
    "fields": [
      "Casting Time",
      "Classes",
      "Components",
      "Duration",
      "Level",
      "Range",
      "Source"
    ]
  },
  "parse": {
    "status": "ok",
    "warnings": [],
    "unmapped": []
  }
}