{
  "schema": "ttrpg-spell/0.1",
  "id": "pf2e:pc1:liminal-doorway",
  "name": "Liminal Doorway",
  "gameSystem": "pf2e",
  "variant": "pc1",
  "source": {
    "code": "pc1",
    "name": "PC1 p.341",
    "page": 341,
    "path": "spells/pf2e/pc1/liminal-doorway.md"
  },
  "level": {
    "kind": "rank",
    "value": 4,
    "display": "Spell 4"
  },
  "identity": {
    "rarity": "uncommon",
    "traits": [
      "uncommon",
      "concentrate",
      "extradimensional",
      "manipulate"
    ],
    "school": null,
    "traditions": [
      "arcane",
      "occult"
    ],
    "classes": [],
    "cantrip": false,
    "ritual": false
  },
  "activity": {
    "unit": "minute",
    "number": 10,
    "symbol": null
  },
  "trigger": null,
  "components": {
    "list": [],
    "material": null,
    "cost": null,
    "currency": null,
    "consumed": null
  },
  "range": {
    "text": "touch",
    "value": null,
    "unit": null
  },
  "targets": null,
  "area": null,
  "duration": {
    "text": "8 hours",
    "value": 8,
    "unit": "hour",
    "concentration": false,
    "sustained": false
  },
  "save": null,
  "attack": null,
  "damage": [],
  "heightening": [],
  "entries": [
    "You draw a chalk doorway on an unbroken surface, which opens into an extradimensional space. Any creature treating the drawing as an actual door can Interact to touch the doorknob and pass through. The warped, chalk-drawn room beyond the door is 20 feet in width, depth, and height. The space is unadorned and empty, with chalk lines indicating the corners of the walls.",
    "If the drawing is scrubbed away, the underlying surface is broken, or a creature attempts to enter the space that would put it over capacity, the space begins to collapse. The space ejects one creature at random each round, depositing it on the nearest open ground, until all creatures are returned outside."
  ],
  "systemExtras": {
    "fields": [
      "Cast",
      "Duration",
      "Level",
      "Range",
      "Source",
      "Traditions"
    ]
  },
  "parse": {
    "status": "ok",
    "warnings": [],
    "unmapped": []
  }
}