{
  "schema": "ttrpg-spell/0.1",
  "id": "dnd5e:deepmagic:wolfsong",
  "name": "Wolfsong",
  "gameSystem": "dnd5e",
  "variant": "deepmagic",
  "source": {
    "code": "deep_magic",
    "name": "Deep Magic 5e",
    "page": null,
    "path": "spells/5e/deep_magic/wolfsong.md"
  },
  "level": {
    "kind": "level",
    "value": 1,
    "display": "1"
  },
  "identity": {
    "rarity": null,
    "traits": [],
    "school": "Transmutation",
    "traditions": [],
    "classes": [
      "Druid",
      "Ranger"
    ],
    "cantrip": false,
    "ritual": false
  },
  "activity": {
    "unit": "action",
    "number": 1,
    "symbol": null
  },
  "trigger": null,
  "components": {
    "list": [
      "verbal",
      "somatic"
    ],
    "material": null,
    "cost": null,
    "currency": null,
    "consumed": null
  },
  "range": {
    "text": "Self",
    "value": null,
    "unit": null
  },
  "targets": null,
  "area": null,
  "duration": {
    "text": "Instantaneous",
    "value": null,
    "unit": null,
    "concentration": false,
    "sustained": false
  },
  "save": null,
  "attack": null,
  "damage": [],
  "heightening": [
    {
      "kind": "slot",
      "step": null,
      "atRank": null,
      "text": "When you cast this spell using a spell slot of 2nd level or higher, you can name another specific recipient for each slot level above 2nd."
    }
  ],
  "entries": [
    "You emit a howl that can be heard clearly from 300 feet away outdoors. The howl can convey a message of up to nine words, which can be understood by all dogs and wolves in that area, as well as (if you choose) one specific creature of any kind that you name when casting the spell.",
    "If you cast the spell indoors and aboveground, the howl can be heard out to 200 feet from you. If you cast the spell underground, the howl can be heard from 100 feet away. A creature that understands the message is not compelled to act in a particular way, though the nature of the message might suggest or even dictate a course of action."
  ],
  "systemExtras": {
    "fields": [
      "Casting Time",
      "Classes",
      "Components",
      "Duration",
      "Level",
      "Range",
      "Source"
    ]
  },
  "parse": {
    "status": "ok",
    "warnings": [],
    "unmapped": []
  }
}