{
  "schema": "ttrpg-spell/0.1",
  "id": "pf2e:som:rapid-adaptation",
  "name": "Rapid Adaptation",
  "gameSystem": "pf2e",
  "variant": "som",
  "source": {
    "code": "som",
    "name": "SoM p.124",
    "page": 124,
    "path": "spells/pf2e/som/rapid-adaptation.md"
  },
  "level": {
    "kind": "rank",
    "value": 2,
    "display": "Spell 2"
  },
  "identity": {
    "rarity": "common",
    "traits": [
      "transmutation"
    ],
    "school": null,
    "traditions": [
      "arcane",
      "primal"
    ],
    "classes": [],
    "cantrip": false,
    "ritual": false
  },
  "activity": {
    "unit": "action",
    "number": 2,
    "symbol": "◆◆"
  },
  "trigger": null,
  "components": {
    "list": [
      "somatic",
      "verbal"
    ],
    "material": null,
    "cost": null,
    "currency": null,
    "consumed": null
  },
  "range": {
    "text": "touch",
    "value": null,
    "unit": null
  },
  "targets": "your companion or eidolon",
  "area": null,
  "duration": {
    "text": "1 hour",
    "value": 1,
    "unit": "hour",
    "concentration": false,
    "sustained": false
  },
  "save": null,
  "attack": null,
  "damage": [],
  "heightening": [],
  "entries": [
    "You flood the target with energy from the terrain around it, compressing centuries of evolution into a single moment.",
    "The target gains one of the following natural adaptations based on the surrounding environment."
  ],
  "systemExtras": {
    "fields": [
      "Cast",
      "Duration",
      "Level",
      "Range",
      "Source",
      "Targets",
      "Traditions"
    ]
  },
  "parse": {
    "status": "ok",
    "warnings": [],
    "unmapped": []
  }
}