{
  "schema": "ttrpg-spell/0.1",
  "id": "pf2e:crb:burning-hands",
  "name": "Burning Hands",
  "gameSystem": "pf2e",
  "variant": "crb",
  "source": {
    "code": "crb",
    "name": "CRB p.322",
    "page": 322,
    "path": "spells/pf2e/crb/burning-hands.md"
  },
  "level": {
    "kind": "rank",
    "value": 1,
    "display": "Spell 1"
  },
  "identity": {
    "rarity": "common",
    "traits": [
      "evocation",
      "fire"
    ],
    "school": null,
    "traditions": [
      "arcane",
      "primal"
    ],
    "classes": [],
    "cantrip": false,
    "ritual": false
  },
  "activity": {
    "unit": "action",
    "number": 2,
    "symbol": "◆◆"
  },
  "trigger": null,
  "components": {
    "list": [
      "somatic",
      "verbal"
    ],
    "material": null,
    "cost": null,
    "currency": null,
    "consumed": null
  },
  "range": null,
  "targets": null,
  "area": {
    "shape": "cone",
    "size": 15,
    "unit": "ft",
    "text": "15-foot cone"
  },
  "duration": null,
  "save": {
    "defense": "reflex",
    "dc": null,
    "basic": true,
    "outcomes": {
      "criticalSuccess": "none",
      "success": "half",
      "failure": "full",
      "criticalFailure": "double"
    }
  },
  "attack": null,
  "damage": [
    {
      "formula": "2d6",
      "average": null,
      "type": "fire"
    }
  ],
  "heightening": [
    {
      "kind": "increment",
      "step": 1,
      "atRank": null,
      "text": "The damage increases by 2d6."
    }
  ],
  "entries": [
    "Gouts of flame rush from your hands. You deal 2d6 fire damage to creatures in the area."
  ],
  "systemExtras": {
    "fields": [
      "Area",
      "Cast",
      "Level",
      "Saving Throw",
      "Source",
      "Traditions"
    ]
  },
  "parse": {
    "status": "ok",
    "warnings": [],
    "unmapped": []
  }
}