{
  "schema": "ttrpg-spell/0.1",
  "id": "dnd5e:deepmagic:semblance-of-dread",
  "name": "Semblance of Dread",
  "gameSystem": "dnd5e",
  "variant": "deepmagic",
  "source": {
    "code": "deep_magic",
    "name": "Deep Magic 5e",
    "page": null,
    "path": "spells/5e/deep_magic/semblance-of-dread.md"
  },
  "level": {
    "kind": "level",
    "value": 0,
    "display": "Cantrip"
  },
  "identity": {
    "rarity": null,
    "traits": [],
    "school": "Illusion",
    "traditions": [],
    "classes": [
      "Bard",
      "Cleric",
      "Druid",
      "Paladin",
      "Ranger",
      "Sorcerer",
      "Warlock",
      "Wizard"
    ],
    "cantrip": true,
    "ritual": false
  },
  "activity": {
    "unit": "action",
    "number": 1,
    "symbol": null
  },
  "trigger": null,
  "components": {
    "list": [
      "verbal",
      "somatic"
    ],
    "material": null,
    "cost": null,
    "currency": null,
    "consumed": null
  },
  "range": {
    "text": "Self (10-foot radius)",
    "value": null,
    "unit": null
  },
  "targets": null,
  "area": null,
  "duration": {
    "text": "Concentration, up to 1 minute",
    "value": 1,
    "unit": "minute",
    "concentration": true,
    "sustained": false
  },
  "save": null,
  "attack": null,
  "damage": [],
  "heightening": [],
  "entries": [
    "You adopt the visage of the faceless god Nyarlathotep. For the duration, any creature within 10 feet of you and able to see you can’t willingly move closer to you unless it makes a successful Wisdom saving throw at the start of its turn. Constructs and undead are immune to this effect.",
    "For the duration of the spell, you also gain vulnerability to radiant damage and have advantage on saving throws against effects that cause the frightened condition."
  ],
  "systemExtras": {
    "fields": [
      "Casting Time",
      "Classes",
      "Components",
      "Duration",
      "Level",
      "Range",
      "Source"
    ]
  },
  "parse": {
    "status": "ok",
    "warnings": [],
    "unmapped": []
  }
}