{
  "schema": "ttrpg-spell/0.1",
  "id": "dnd5e:deepmagic:ally-aegis",
  "name": "Ally Aegis",
  "gameSystem": "dnd5e",
  "variant": "deepmagic",
  "source": {
    "code": "deep_magic",
    "name": "Deep Magic 5e",
    "page": null,
    "path": "spells/5e/deep_magic/ally-aegis.md"
  },
  "level": {
    "kind": "level",
    "value": 6,
    "display": "6"
  },
  "identity": {
    "rarity": null,
    "traits": [],
    "school": "Abjuration",
    "traditions": [],
    "classes": [
      "Bard",
      "Cleric",
      "Sorcerer",
      "Wizard"
    ],
    "cantrip": false,
    "ritual": false
  },
  "activity": {
    "unit": "reaction",
    "number": 1,
    "symbol": null
  },
  "trigger": "when your ally is hit by an attack or is targeted by a spell that deals damage other than psychic damage",
  "components": {
    "list": [
      "verbal",
      "somatic"
    ],
    "material": null,
    "cost": null,
    "currency": null,
    "consumed": null
  },
  "range": {
    "text": "60 feet",
    "value": 60,
    "unit": "ft"
  },
  "targets": null,
  "area": null,
  "duration": {
    "text": "1 round",
    "value": 1,
    "unit": "round",
    "concentration": false,
    "sustained": false
  },
  "save": null,
  "attack": null,
  "damage": [],
  "heightening": [
    {
      "kind": "slot",
      "step": null,
      "atRank": null,
      "text": "When you cast this spell using a spell slot of 7th level or higher, you can target one additional ally for each slot level above 6th."
    }
  ],
  "entries": [
    "When you see an ally within range in imminent danger, you can use your reaction to protect that creature with a shield of magical force. Until the start of your next turn, your ally has a +5 bonus to AC and is immune to force damage. In addition, if your ally must make a saving throw against an enemy’s spell that deals damage, the ally takes half as much damage on a failed saving throw and no damage on a successful save. Ally aegis offers no protection, however, against psychic damage from any source."
  ],
  "systemExtras": {
    "fields": [
      "Casting Time",
      "Classes",
      "Components",
      "Duration",
      "Level",
      "Range",
      "Source"
    ]
  },
  "parse": {
    "status": "ok",
    "warnings": [],
    "unmapped": []
  }
}