{
  "schema": "ttrpg-spell/0.1",
  "id": "pf2e:pc2:concordant-choir",
  "name": "Concordant Choir",
  "gameSystem": "pf2e",
  "variant": "pc2",
  "source": {
    "code": "pc2",
    "name": "PC2 p.243",
    "page": 243,
    "path": "spells/pf2e/pc2/concordant-choir.md"
  },
  "level": {
    "kind": "rank",
    "value": 1,
    "display": "Spell 1"
  },
  "identity": {
    "rarity": "common",
    "traits": [
      "concentrate",
      "sonic"
    ],
    "school": null,
    "traditions": [
      "divine",
      "occult"
    ],
    "classes": [],
    "cantrip": false,
    "ritual": false
  },
  "activity": {
    "unit": "action",
    "number": 1,
    "numberMax": 3,
    "symbol": null
  },
  "trigger": null,
  "components": {
    "list": [],
    "material": null,
    "cost": null,
    "currency": null,
    "consumed": null
  },
  "range": {
    "text": "30 feet",
    "value": 30,
    "unit": "ft"
  },
  "targets": "varies",
  "area": null,
  "duration": null,
  "save": {
    "defense": "fortitude",
    "dc": null,
    "basic": true,
    "outcomes": {
      "criticalSuccess": "none",
      "success": "half",
      "failure": "full",
      "criticalFailure": "double"
    }
  },
  "attack": null,
  "damage": [],
  "heightening": [
    {
      "kind": "increment",
      "step": 1,
      "atRank": null,
      "text": "The damage increases by 1d4 for the 1-action version, or 2d4 for the other versions."
    }
  ],
  "entries": [
    "You unleash a dangerous consonance of reverberating sound, focusing on a single target or spreading out to damage many foes. The number of actions you spend Cast A Spell this Spell determines its targets, range, area, and other parameters."
  ],
  "systemExtras": {
    "fields": [
      "Cast",
      "Level",
      "Range",
      "Saving Throw",
      "Source",
      "Targets",
      "Traditions"
    ]
  },
  "parse": {
    "status": "ok",
    "warnings": [],
    "unmapped": []
  }
}