{
  "schema": "ttrpg-spell/0.1",
  "id": "dnd5e:srd51:augury",
  "name": "Augury",
  "gameSystem": "dnd5e",
  "variant": "srd51",
  "source": {
    "code": "5.1_srd",
    "name": "5.1 SRD (D&D 2014)",
    "page": null,
    "path": "spells/5e/5.1_srd/augury.md"
  },
  "level": {
    "kind": "level",
    "value": 2,
    "display": "2"
  },
  "identity": {
    "rarity": null,
    "traits": [],
    "school": "Divination",
    "traditions": [],
    "classes": [
      "Cleric",
      "Ritual Caster"
    ],
    "cantrip": false,
    "ritual": true
  },
  "activity": {
    "unit": "minute",
    "number": 1,
    "symbol": null
  },
  "trigger": null,
  "components": {
    "list": [
      "verbal",
      "somatic",
      "material"
    ],
    "material": "Specially marked sticks, bones, or similar tokens worth at least 25gp.",
    "cost": 25,
    "currency": "gp",
    "consumed": false
  },
  "range": {
    "text": "Self",
    "value": null,
    "unit": null
  },
  "targets": null,
  "area": null,
  "duration": {
    "text": "Instantaneous",
    "value": null,
    "unit": null,
    "concentration": false,
    "sustained": false
  },
  "save": null,
  "attack": null,
  "damage": [],
  "heightening": [],
  "entries": [
    "By casting gem-inlaid sticks, rolling dragon bones, laying out ornate cards, or employing some other divining tool, you receive an omen from an otherworldly entity about the results of a specific course of action that you plan to take within the next 30 minutes. The DM chooses from the following possible omens:"
  ],
  "systemExtras": {
    "fields": [
      "Casting Time",
      "Classes",
      "Components",
      "Duration",
      "Level",
      "Range",
      "Source"
    ]
  },
  "parse": {
    "status": "ok",
    "warnings": [],
    "unmapped": []
  }
}