{
  "schema": "ttrpg-spell/0.1",
  "id": "pf2e:apg:armor-of-bones",
  "name": "Armor of Bones",
  "gameSystem": "pf2e",
  "variant": "apg",
  "source": {
    "code": "apg",
    "name": "APG p.230",
    "page": 230,
    "path": "spells/pf2e/apg/armor-of-bones.md"
  },
  "level": {
    "kind": "focus",
    "value": 3,
    "display": "Focus 3"
  },
  "identity": {
    "rarity": "uncommon",
    "traits": [
      "uncommon",
      "cursebound",
      "necromancy",
      "oracle"
    ],
    "school": null,
    "traditions": [],
    "classes": [],
    "cantrip": false,
    "ritual": false
  },
  "activity": {
    "unit": "action",
    "number": 1,
    "symbol": "◆"
  },
  "trigger": null,
  "components": {
    "list": [
      "somatic"
    ],
    "material": null,
    "cost": null,
    "currency": null,
    "consumed": null
  },
  "range": null,
  "targets": null,
  "area": null,
  "duration": {
    "text": "1 minute",
    "value": 1,
    "unit": "minute",
    "concentration": false,
    "sustained": false
  },
  "save": null,
  "attack": null,
  "damage": [],
  "heightening": [
    {
      "kind": "increment",
      "step": 1,
      "atRank": null,
      "text": "Increase the resistance by 1."
    }
  ],
  "entries": [
    "You ossify your physical form, mimicking the durability of bone. You gain resistance 3 to cold, electricity, fire, piercing, and slashing damage."
  ],
  "systemExtras": {
    "fields": [
      "Cast",
      "Duration",
      "Level",
      "Source"
    ]
  },
  "parse": {
    "status": "ok",
    "warnings": [],
    "unmapped": []
  }
}