{
  "schema": "ttrpg-spell/0.1",
  "id": "dnd5e:deepmagic:accelerate",
  "name": "Accelerate",
  "gameSystem": "dnd5e",
  "variant": "deepmagic",
  "source": {
    "code": "deep_magic",
    "name": "Deep Magic 5e",
    "page": null,
    "path": "spells/5e/deep_magic/accelerate.md"
  },
  "level": {
    "kind": "level",
    "value": 3,
    "display": "3"
  },
  "identity": {
    "rarity": null,
    "traits": [],
    "school": "Transmutation",
    "traditions": [],
    "classes": [
      "Bard",
      "Cleric",
      "Druid",
      "Sorcerer",
      "Wizard"
    ],
    "cantrip": false,
    "ritual": false
  },
  "activity": {
    "unit": "action",
    "number": 1,
    "symbol": null
  },
  "trigger": null,
  "components": {
    "list": [
      "verbal",
      "somatic",
      "material"
    ],
    "material": "a toy top",
    "cost": null,
    "currency": null,
    "consumed": false
  },
  "range": {
    "text": "Touch",
    "value": null,
    "unit": null
  },
  "targets": null,
  "area": null,
  "duration": {
    "text": "Concentration, up to 1 minute",
    "value": 1,
    "unit": "minute",
    "concentration": true,
    "sustained": false
  },
  "save": null,
  "attack": null,
  "damage": [],
  "heightening": [
    {
      "kind": "slot",
      "step": null,
      "atRank": null,
      "text": "When you cast this spell using a spell slot of 4th level or higher, you can affect one additional creature for each slot level above 3rd."
    }
  ],
  "entries": [
    "Choose up to three willing creatures within range, which can include you. For the duration of the spell, each target’s walking speed is doubled. Each target can also use a bonus action on each of its turns to take the Dash action, and it has advantage on Dexterity saving throws."
  ],
  "systemExtras": {
    "fields": [
      "Casting Time",
      "Classes",
      "Components",
      "Duration",
      "Level",
      "Range",
      "Source"
    ]
  },
  "parse": {
    "status": "ok",
    "warnings": [],
    "unmapped": []
  }
}