{
  "schema": "ttrpg-spell/0.1",
  "id": "dnd5e:deepmagic:umbral-storm",
  "name": "Umbral Storm",
  "gameSystem": "dnd5e",
  "variant": "deepmagic",
  "source": {
    "code": "deep_magic",
    "name": "Deep Magic 5e",
    "page": null,
    "path": "spells/5e/deep_magic/umbral-storm.md"
  },
  "level": {
    "kind": "level",
    "value": 9,
    "display": "9"
  },
  "identity": {
    "rarity": null,
    "traits": [],
    "school": "Necromancy",
    "traditions": [],
    "classes": [
      "Sorcerer",
      "Warlock",
      "Wizard"
    ],
    "cantrip": false,
    "ritual": false
  },
  "activity": {
    "unit": "action",
    "number": 1,
    "symbol": null
  },
  "trigger": null,
  "components": {
    "list": [
      "verbal",
      "somatic"
    ],
    "material": null,
    "cost": null,
    "currency": null,
    "consumed": null
  },
  "range": {
    "text": "120 feet",
    "value": 120,
    "unit": "ft"
  },
  "targets": null,
  "area": {
    "shape": "sphere",
    "size": 20,
    "unit": "ft",
    "text": "20-foot-radius sphere"
  },
  "duration": {
    "text": "Concentration, up to 1 minute",
    "value": 1,
    "unit": "minute",
    "concentration": true,
    "sustained": false
  },
  "save": null,
  "attack": null,
  "damage": [
    {
      "formula": "6d8",
      "average": null,
      "type": "necrotic"
    }
  ],
  "heightening": [],
  "entries": [
    "You create a channel to a region of the Plane of Shadow that is inimical to life and order. A storm of dark, raging entropy fills a 20-foot-radius sphere centered on a point you can see within range. Any creature that starts its turn in the storm or enters it for the first time on its turn takes 6d8 necrotic damage and gains one level of exhaustion; a successful Constitution saving throw halves the damage and prevents the exhaustion.",
    "You can use a bonus action on your turn to move the area of the storm 30 feet in any direction."
  ],
  "systemExtras": {
    "fields": [
      "Casting Time",
      "Classes",
      "Components",
      "Duration",
      "Level",
      "Range",
      "Source"
    ]
  },
  "parse": {
    "status": "ok",
    "warnings": [],
    "unmapped": []
  }
}