{
  "schema": "ttrpg-spell/0.1",
  "id": "pf2e:crb:synesthesia",
  "name": "Synesthesia",
  "gameSystem": "pf2e",
  "variant": "crb",
  "source": {
    "code": "crb",
    "name": "CRB p.376",
    "page": 376,
    "path": "spells/pf2e/crb/synesthesia.md"
  },
  "level": {
    "kind": "rank",
    "value": 5,
    "display": "Spell 5"
  },
  "identity": {
    "rarity": "common",
    "traits": [
      "divination",
      "mental"
    ],
    "school": null,
    "traditions": [
      "occult"
    ],
    "classes": [],
    "cantrip": false,
    "ritual": false
  },
  "activity": {
    "unit": "action",
    "number": 2,
    "symbol": "◆◆"
  },
  "trigger": null,
  "components": {
    "list": [
      "somatic",
      "verbal"
    ],
    "material": null,
    "cost": null,
    "currency": null,
    "consumed": null
  },
  "range": {
    "text": "30 feet",
    "value": 30,
    "unit": "ft"
  },
  "targets": "1 creature",
  "area": null,
  "duration": {
    "text": "1 minute",
    "value": 1,
    "unit": "minute",
    "concentration": false,
    "sustained": false
  },
  "save": {
    "defense": "will",
    "dc": null,
    "basic": false,
    "outcomes": {
      "criticalSuccess": "The target is unaffected.",
      "success": "The target is affected for 1 round.",
      "failure": "The target is affected for 1 minute.",
      "criticalFailure": "As failure, and the target is stunned 2 as it attempts to process the sensory shifts."
    }
  },
  "attack": null,
  "damage": [],
  "heightening": [
    {
      "kind": "fixed",
      "step": null,
      "atRank": 9,
      "text": "You can target up to five creatures."
    }
  ],
  "entries": [
    "The target's senses are suddenly rewired in unexpected ways, causing them to process noises as bursts of color, smells as sounds, and so on. This has three effects, and the target must attempt a Will save."
  ],
  "systemExtras": {
    "fields": [
      "Cast",
      "Duration",
      "Level",
      "Range",
      "Saving Throw",
      "Source",
      "Targets",
      "Traditions"
    ]
  },
  "parse": {
    "status": "ok",
    "warnings": [],
    "unmapped": []
  }
}