{
  "schema": "ttrpg-spell/0.1",
  "id": "pf2e:crb:gaseous-form",
  "name": "Gaseous Form",
  "gameSystem": "pf2e",
  "variant": "crb",
  "source": {
    "code": "crb",
    "name": "CRB p.340",
    "page": 340,
    "path": "spells/pf2e/crb/gaseous-form.md"
  },
  "level": {
    "kind": "rank",
    "value": 4,
    "display": "Spell 4"
  },
  "identity": {
    "rarity": "common",
    "traits": [
      "polymorph",
      "transmutation"
    ],
    "school": null,
    "traditions": [
      "arcane",
      "occult",
      "primal"
    ],
    "classes": [],
    "cantrip": false,
    "ritual": false
  },
  "activity": {
    "unit": "action",
    "number": 2,
    "symbol": "◆◆"
  },
  "trigger": null,
  "components": {
    "list": [
      "somatic",
      "verbal"
    ],
    "material": null,
    "cost": null,
    "currency": null,
    "consumed": null
  },
  "range": {
    "text": "touch",
    "value": null,
    "unit": null
  },
  "targets": "1 willing creature",
  "area": null,
  "duration": {
    "text": "5 minutes (dismissible)",
    "value": 5,
    "unit": "minute",
    "concentration": false,
    "sustained": false
  },
  "save": null,
  "attack": null,
  "damage": [],
  "heightening": [],
  "entries": [
    "The target transforms into a vaporous state. In this state, the target is amorphous and loses any item bonus to AC.",
    "It gains resistance 8 to physical damage and is immune to precision damage. It can't cast spells, activate items, or use actions that have the attack or manipulate trait. It gains a fly Speed of 10 feet and can slip through tiny cracks. The target can Dismiss the spell."
  ],
  "systemExtras": {
    "fields": [
      "Cast",
      "Duration",
      "Level",
      "Range",
      "Source",
      "Targets",
      "Traditions"
    ]
  },
  "parse": {
    "status": "ok",
    "warnings": [],
    "unmapped": []
  }
}