{
  "schema": "ttrpg-spell/0.1",
  "id": "pf2e:crb:fatal-aria",
  "name": "Fatal Aria",
  "gameSystem": "pf2e",
  "variant": "crb",
  "source": {
    "code": "crb",
    "name": "CRB p.386",
    "page": 386,
    "path": "spells/pf2e/crb/fatal-aria.md"
  },
  "level": {
    "kind": "focus",
    "value": 10,
    "display": "Focus 10"
  },
  "identity": {
    "rarity": "uncommon",
    "traits": [
      "uncommon",
      "bard",
      "composition",
      "death",
      "emotion",
      "enchantment",
      "mental"
    ],
    "school": null,
    "traditions": [],
    "classes": [],
    "cantrip": false,
    "ritual": false
  },
  "activity": {
    "unit": "action",
    "number": 1,
    "symbol": "◆"
  },
  "trigger": null,
  "components": {
    "list": [
      "verbal"
    ],
    "material": null,
    "cost": null,
    "currency": null,
    "consumed": null
  },
  "range": {
    "text": "30 feet",
    "value": 30,
    "unit": "ft"
  },
  "targets": "1 creature",
  "area": null,
  "duration": null,
  "save": null,
  "attack": null,
  "damage": [],
  "heightening": [],
  "entries": [
    "You perform music so perfect that the target may die of joy or sorrow. Once targeted, the creature becomes temporarily immune for 1 minute. The effect of the spell depends on the target's level and current Hit Points."
  ],
  "systemExtras": {
    "fields": [
      "Cast",
      "Level",
      "Range",
      "Source",
      "Targets"
    ]
  },
  "parse": {
    "status": "ok",
    "warnings": [],
    "unmapped": []
  }
}