{
  "schema": "ttrpg-spell/0.1",
  "id": "pf2e:da:warp-step",
  "name": "Warp Step",
  "gameSystem": "pf2e",
  "variant": "da",
  "source": {
    "code": "da",
    "name": "DA p.107",
    "page": 107,
    "path": "spells/pf2e/da/warp-step.md"
  },
  "level": {
    "kind": "rank",
    "value": 1,
    "display": "Spell 1"
  },
  "identity": {
    "rarity": "common",
    "traits": [
      "cantrip",
      "conjuration"
    ],
    "school": null,
    "traditions": [
      "arcane",
      "occult"
    ],
    "classes": [],
    "cantrip": true,
    "ritual": false
  },
  "activity": {
    "unit": "action",
    "number": 2,
    "symbol": "◆◆"
  },
  "trigger": null,
  "components": {
    "list": [
      "somatic",
      "verbal"
    ],
    "material": null,
    "cost": null,
    "currency": null,
    "consumed": null
  },
  "range": null,
  "targets": null,
  "area": null,
  "duration": null,
  "save": null,
  "attack": null,
  "damage": [],
  "heightening": [],
  "entries": [
    "When you walk, the earth warps beneath your feet—your steps extend, distance contracts, and everything is just a little bit closer. You gain a +5-foot status bonus to your Speed until the end of your turn. You then Stride twice. You can use warp step to Burrow, Climb, Fly, or Swim instead of Stride if you have the corresponding movement type."
  ],
  "systemExtras": {
    "fields": [
      "Cast",
      "Level",
      "Source",
      "Traditions"
    ]
  },
  "parse": {
    "status": "ok",
    "warnings": [],
    "unmapped": []
  }
}