{
  "schema": "ttrpg-spell/0.1",
  "id": "dnd5e:a5e:divine-word",
  "name": "Divine Word",
  "gameSystem": "dnd5e",
  "variant": "a5e",
  "source": {
    "code": "level_up_advanced",
    "name": "Level Up Advanced 5e",
    "page": null,
    "path": "spells/5e/level_up_advanced/divine-word-a5e.md"
  },
  "level": {
    "kind": "level",
    "value": 7,
    "display": "7"
  },
  "identity": {
    "rarity": null,
    "traits": [],
    "school": "Evocation",
    "traditions": [],
    "classes": [
      "Cleric"
    ],
    "cantrip": false,
    "ritual": false
  },
  "activity": {
    "unit": "bonus",
    "number": 1,
    "symbol": null
  },
  "trigger": null,
  "components": {
    "list": [
      "verbal"
    ],
    "material": null,
    "cost": null,
    "currency": null,
    "consumed": null
  },
  "range": {
    "text": "30 feet",
    "value": 30,
    "unit": "ft"
  },
  "targets": null,
  "area": null,
  "duration": {
    "text": "Instantaneous",
    "value": null,
    "unit": null,
    "concentration": false,
    "sustained": false
  },
  "save": null,
  "attack": null,
  "damage": [],
  "heightening": [],
  "entries": [
    "You utter a primordial imprecation that brings woe upon your enemies. A target suffers an effect based on its current hit points.",
    "* Fewer than 50 hit points: deafened for 1 minute.",
    "* Fewer than 40 hit points: blinded and deafened for 10 minutes.",
    "* Fewer than 30 hit points: stunned, blinded, and deafened for 1 hour.",
    "* Fewer than 20 hit points: instantly killed outright.",
    "Additionally, when a celestial, elemental, fey, or fiend is affected by this spell it is immediately forced back to its home plane and for 24 hours it is unable to return to your current plane by any means less powerful than a wish spell. Such a creature does not suffer this effect if it is already on its plane of origin."
  ],
  "systemExtras": {
    "fields": [
      "Casting Time",
      "Classes",
      "Components",
      "Duration",
      "Level",
      "Range",
      "Source"
    ]
  },
  "parse": {
    "status": "ok",
    "warnings": [],
    "unmapped": []
  }
}