{
  "schema": "ttrpg-spell/0.1",
  "id": "dnd5e:deepmagic:hematomancy",
  "name": "Hematomancy",
  "gameSystem": "dnd5e",
  "variant": "deepmagic",
  "source": {
    "code": "deep_magic",
    "name": "Deep Magic 5e",
    "page": null,
    "path": "spells/5e/deep_magic/hematomancy.md"
  },
  "level": {
    "kind": "level",
    "value": 3,
    "display": "3"
  },
  "identity": {
    "rarity": null,
    "traits": [],
    "school": "Divination",
    "traditions": [],
    "classes": [
      "Cleric",
      "Sorcerer",
      "Wizard"
    ],
    "cantrip": false,
    "ritual": false
  },
  "activity": {
    "unit": "minute",
    "number": 1,
    "symbol": null
  },
  "trigger": null,
  "components": {
    "list": [
      "verbal",
      "somatic",
      "material"
    ],
    "material": "a drop of a creature’s blood",
    "cost": null,
    "currency": null,
    "consumed": false
  },
  "range": {
    "text": "Touch",
    "value": null,
    "unit": null
  },
  "targets": null,
  "area": null,
  "duration": {
    "text": "Instantaneous",
    "value": null,
    "unit": null,
    "concentration": false,
    "sustained": false
  },
  "save": {
    "defense": "wis",
    "dc": null,
    "basic": false,
    "outcomes": {
      "success": "none",
      "failure": "full"
    }
  },
  "attack": null,
  "damage": [],
  "heightening": [],
  "entries": [
    "You can learn information about a creature whose blood you possess. The target must make a Wisdom saving throw. If the target knows you’re casting the spell, it can fail the saving throw voluntarily if it wants you to learn the information. On a successful save, the target isn’t affected, and you can’t use this spell against it again for 24 hours. On a failed save, or if the blood belongs to a dead creature, you learn the following information:",
    "* The target’s most common name (if any).",
    "* The target’s creature type (and subtype, if any), gender, and which of its ability scores is highest (though not the exact numerical score).",
    "* The target’s current status (alive, dead, sick, wounded, healthy, etc.).",
    "* The circumstances of the target shedding the blood you’re holding (bleeding wound, splatter from an attack, how long ago it was shed, etc.).",
    "Alternatively, you can forgo all of the above information and instead use the blood as a beacon to track the target. For 1 hour, as long as you are on the same plane of existence as the creature, you know the direction and distance to the target’s location at the time you cast this spell. While moving toward the location, if you are presented with a choice of paths, the spell automatically indicates which path provides the shortest and most direct route to the location."
  ],
  "systemExtras": {
    "fields": [
      "Casting Time",
      "Classes",
      "Components",
      "Duration",
      "Level",
      "Range",
      "Source"
    ]
  },
  "parse": {
    "status": "ok",
    "warnings": [],
    "unmapped": []
  }
}